{
  "schema_name": "gunnchos.pilot_assignment",
  "schema_version": "1.0.0",
  "assignment_id": "asn_9468def72bc740ed",
  "matrix_cell_id": "rehearsal_zone_rehearsal_wifi_normal_learn",
  "protocol_version": "gate3-pilot-v1",
  "collection_day_id": "rehearsal_day",
  "named_test_zone": "zone_rehearsal",
  "location_category": "home_or_private_indoor",
  "indoor_outdoor": "indoor",
  "stationary_or_moving": "stationary",
  "network_condition": "wifi_normal",
  "expected_network_transport": "wifi",
  "workload_profile": "learn",
  "planned_duration_seconds": 300,
  "session_mode": "PILOT_REHEARSAL",
  "calibration_only": false,
  "rehearsal_only": true,
  "environmental_note_prompt": "Optional notes only. Do not enter street addresses, names, emails, phone numbers, SSIDs, or other identifiers. Max 280 characters.",
  "created_at": "2026-07-23T23:11:04Z",
  "expires_at": "2026-07-24T23:11:04Z",
  "expiry_policy": "expires_24h_after_emit",
  "site_id": "gary",
  "assignment_hash_algorithm": "gunnchos-canonical-json-sha256-v1",
  "producer": {
    "repository": "gunnchos-7gc-ai-ran-field-kit",
    "commit": "ffb237fb29a77f68fe2185b6d72de33edc076748"
  },
  "assignment_hash": "328e22605c90d85b5dfaa3249fc942079268660330ed897c131da28c98ed07e6"
}
