{
  "schema_name": "gunnchos.pilot_assignment",
  "schema_version": "1.0.0",
  "assignment_id": "asn_47b9a01570974825",
  "matrix_cell_id": "day_01_zone_a_wifi_normal_learn",
  "protocol_version": "gate3-pilot-v1",
  "collection_day_id": "day_01",
  "named_test_zone": "zone_a",
  "location_category": "library_or_community_indoor",
  "indoor_outdoor": "indoor",
  "stationary_or_moving": "stationary",
  "network_condition": "wifi_normal",
  "expected_network_transport": "wifi",
  "workload_profile": "learn",
  "planned_duration_seconds": 300,
  "session_mode": "PILOT",
  "calibration_only": false,
  "rehearsal_only": false,
  "environmental_note_prompt": "Optional notes only. Do not enter street addresses, names, emails, phone numbers, SSIDs, or other identifiers. Max 280 characters.",
  "created_at": "2026-07-23T23:11:04Z",
  "expires_at": "2026-07-24T23:11:04Z",
  "expiry_policy": "expires_24h_after_emit",
  "site_id": "gary",
  "assignment_hash_algorithm": "gunnchos-canonical-json-sha256-v1",
  "producer": {
    "repository": "gunnchos-7gc-ai-ran-field-kit",
    "commit": "ffb237fb29a77f68fe2185b6d72de33edc076748"
  },
  "assignment_hash": "12eb0bf34295b9933197b54b4e7020ed4c40f7bf65aa477bab157b0ebd287d23"
}
